{
  "schema": "https://oddkin.dev/schemas/agent-kit/v1.json",
  "library": { "name": "@oddkin/components", "version": "0.4.0" },
  "fingerprint": {
    "generator": { "name": "@oddkin/agent", "version": "0.1.0" },
    "schemaVersion": 1,
    "packages": { "@oddkin/components": "0.4.0", "@oddkin/tokens": "0.4.0" },
    "inputs": "sha256-afabf3dc4676782b883aa92c7e861fa8d44d0304b33e66a9ce687d375550da47"
  },
  "guide": { "path": "GUIDE.md", "budgetBytes": 8192, "bytes": 6120 },
  "entries": [
    { "id": "component:odd-button", "path": "references/components/odd-button.md", "kind": "component", "provenance": "extracted" },
    { "id": "choosing", "path": "references/choosing-components.md", "kind": "choosing", "provenance": "authored" },
    { "id": "task:theming", "path": "references/tasks/theming.md", "kind": "task", "provenance": "authored", "notAuthored": true },
    { "id": "json:components", "path": "json/components.json", "kind": "json", "provenance": "extracted" }
  ],
  "packaging": ["agent-skills", "agents-md"]
}
